{
  "schema_version": 1,
  "version": {
    "id": "v001",
    "status": "working",
    "created": null,
    "basis": []
  },
  "financial": {
    "contract_price": "0.00",
    "has_vat": false,
    "vat_rate": "0",
    "tax_rate": "0",
    "payroll_rate": "0",
    "bonus_rate": "0",
    "bank_guarantee": "0.00",
    "other_named_costs": [],
    "scheme": "direct",
    "intermediary_rate": "0",
    "credit_rate_monthly": "0",
    "expected_return_date": null
  },
  "items": [],
  "payments": [],
  "manual_credit_accruals": []
}
